# Generated by sltgen tool with gpt-4.1
# Test Script: Basic SQL Operations

# 1. Create table
statement ok
CREATE TABLE employees (
    emp_id INTEGER PRIMARY KEY,
    name VARCHAR(100) NOT NULL,
    department VARCHAR(50),
    salary DECIMAL(10, 2) NOT NULL,
    hire_date TIMESTAMP,
    active BOOLEAN DEFAULT TRUE
);

# 2. Insert data
statement ok
INSERT INTO employees (emp_id, name, department, salary, hire_date, active) VALUES
    (1, 'Alice', 'Engineering', 70000.00, '2022-01-15 09:30:00', TRUE),
    (2, 'Bob', 'Marketing', 50000.00, '2021-09-10 10:00:00', TRUE),
    (3, 'Charlie', 'Engineering', 80000.00, '2023-03-18 15:45:00', FALSE),
    (4, 'Diana', NULL, 60000.00, NULL, TRUE);

# 3. Select all data
query rowsort
SELECT emp_id, name, department, salary, hire_date, active FROM employees;
----
1 'Alice' 'Engineering' 70000.00 '2022-01-15 09:30:00' TRUE
2 'Bob' 'Marketing' 50000.00 '2021-09-10 10:00:00' TRUE
3 'Charlie' 'Engineering' 80000.00 '2023-03-18 15:45:00' FALSE
4 'Diana' NULL 60000.00 NULL TRUE

# 4. Basic WHERE clause
query rowsort
SELECT emp_id, name FROM employees WHERE active = TRUE;
----
1 'Alice'
2 'Bob'
4 'Diana'

# 5. Update operation
statement ok
UPDATE employees SET salary = salary + 5000 WHERE department = 'Engineering';

# 6. Check update effect
query rowsort
SELECT emp_id, salary FROM employees WHERE department = 'Engineering';
----
1 75000.00
3 85000.00

# 7. Delete operation
statement ok
DELETE FROM employees WHERE emp_id = 2;

# 8. Check deletion effect
query rowsort
SELECT emp_id FROM employees;
----
1
3
4

# 9. Aggregate function
query rowsort
SELECT department, COUNT(*) AS num_employees FROM employees GROUP BY department;
----
NULL 1
'Engineering' 2

# 10. NULL handling
query rowsort
SELECT name FROM employees WHERE hire_date IS NULL;
----
'Diana'

# 11. Attempt to insert duplicate primary key
statement error
INSERT INTO employees (emp_id, name, department, salary) VALUES (1, 'Eve', 'HR', 55000.00);

# 12. Attempt to insert NULL into NOT NULL column
statement error
INSERT INTO employees (emp_id, name, department, salary) VALUES (5, NULL, 'Support', 43000.00);